{
  "$schema": "https://json-schema.org/draft/2020-12/schema",
  "$id": "https://contracts.station.viasoft.ai/robot-blueprint.json",
  "title": "RobotBlueprint",
  "description": "로봇 한 종류 = 노드 + 작업모듈 + 표준계약의 조합 선언. STATION Field OS의 핵심 일반화: 어떤 로봇이든 Blueprint 하나로 정의된다(온실 thin/pinch, 물류 AMR, 방제 드론 모두 동일 틀). robot-agnostic core.",
  "type": "object",
  "additionalProperties": false,
  "required": ["blueprintId", "robotClass", "label", "nodes"],
  "properties": {
    "blueprintId": {
      "type": "string",
      "pattern": "^blueprint\\.[a-z0-9-]+$",
      "description": "예 blueprint.greenhouse-thin, blueprint.spray-drone"
    },
    "robotClass": { "type": "string", "description": "로봇 분류. 예 greenhouse-thinning-robot, delivery-amr, spray-drone" },
    "label": { "type": "string" },
    "description": { "type": "string" },
    "profile": { "type": "string", "description": "인스턴스 프로파일(도메인). 예 greenhouse. core(robot-agnostic)와 분리." },
    "nodes": {
      "type": "array",
      "description": "이 로봇을 구성하는 컴퓨트 노드. kind 는 권장 표준(MCU/VPU/ACU/Telemetry/LPU) + custom 개방형.",
      "items": {
        "type": "object",
        "additionalProperties": false,
        "required": ["kind", "ownerOrg"],
        "properties": {
          "kind": { "type": "string", "description": "노드 종류(개방형). 권장: MCU·VPU·ACU·Telemetry·LPU, 그 외 custom 허용" },
          "ownerOrg": { "type": "string", "pattern": "^ORG-[A-Z]+$" },
          "role": { "type": "string" }
        }
      }
    },
    "modules": {
      "type": "array",
      "description": "노드에 부착되는 작업모듈(ModuleManifest 참조)",
      "items": {
        "type": "object",
        "additionalProperties": false,
        "required": ["manifestRef", "attachesToNode"],
        "properties": {
          "manifestRef": { "type": "string", "description": "ModuleManifest.manifestId. 예 meta.module.manipulator.v1" },
          "attachesToNode": { "type": "string", "description": "부착 노드 종류" }
        }
      }
    },
    "requiredContracts": {
      "type": "array",
      "items": { "type": "string" },
      "description": "이 로봇이 의존하는 표준 계약명. 예 Signal, Command, Event, Calibration"
    }
  }
}
