{
  "blueprintId": "blueprint.greenhouse-pinch",
  "robotClass": "greenhouse-pinching-robot",
  "label": "온실 적심 로봇 (pinch)",
  "description": "thin 과 동일 노드 골격, 작업모듈만 적심 EE 로 교체. Blueprint 차이 = 모듈 1개.",
  "profile": "greenhouse",
  "nodes": [
    { "kind": "MCU", "ownerOrg": "ORG-AGE", "role": "모바일 베이스" },
    { "kind": "LPU", "ownerOrg": "ORG-DAEDONG", "role": "측위·맵" },
    { "kind": "VPU", "ownerOrg": "ORG-META", "role": "비전·AI인식" },
    { "kind": "ACU", "ownerOrg": "ORG-META", "role": "자율제어" },
    { "kind": "Telemetry", "ownerOrg": "ORG-VIA", "role": "통신 게이트웨이" }
  ],
  "modules": [
    { "manifestRef": "meta.module.manipulator.v1", "attachesToNode": "ACU" },
    { "manifestRef": "meta.module.pinching_ee.v1", "attachesToNode": "ACU" }
  ],
  "requiredContracts": ["Signal", "Command", "Event", "Calibration", "ProtocolProfile"]
}
